sentences,feeling_category
"Radiating warmth and kindness, she effortlessly brightens any room she enters.",positive
"His infectious enthusiasm uplifts everyone around him, spreading joy and encouragement.",positive
"A beacon of empathy, she listens attentively and offers thoughtful advice without hesitation.",positive
"His unwavering optimism is a source of inspiration, even in the face of challenges.",positive
"With a heart full of compassion, she volunteers tirelessly to help those in need.",positive
"His creativity knows no bounds, constantly innovating and inspiring those around him.",positive
"A true team player, she fosters collaboration and brings out the best in others.",positive
"His integrity and honesty are pillars of strength that others rely on and admire.",positive
"She approaches every obstacle with determination and a can-do attitude.",positive
"His humility despite his achievements makes him a role model for many.",positive
"A natural leader, she leads with fairness and empowers others to succeed.",positive
"His resilience in adversity serves as a testament to his inner strength.",positive
"With a genuine smile, she effortlessly brightens even the toughest days.",positive
"His generosity extends beyond material things, always willing to give his time and support.",positive
"She radiates confidence, inspiring others to believe in themselves.",positive
"His sense of humor is infectious, lifting spirits and creating camaraderie.",positive
"She celebrates the successes of others as if they were her own.",positive
"His patience is endless, always willing to lend a helping hand.",positive
"With boundless energy, she tackles challenges with enthusiasm and determination.",positive
"His positive outlook on life is contagious, spreading hope and optimism wherever he goes.",positive
"Her genuine kindness touches everyone she meets, leaving a lasting impression.",positive
"His dedication to excellence motivates his team to strive for greatness.",positive
"With a deep sense of responsibility, she always goes above and beyond expectations.",positive
"His commitment to learning fuels continuous growth and development.",positive
"Her grace under pressure makes her a reliable source of strength in difficult times.",positive
"His boundless curiosity sparks innovation and new ideas within the organization.",positive
"A natural mentor, she guides others with patience and understanding.",positive
"Her optimism in the face of adversity is a testament to her resilience.",positive
"His unwavering belief in teamwork fosters a supportive and productive environment.",positive
"With a humble demeanor, she never seeks recognition for her countless acts of kindness.",positive
"His ability to adapt to change ensures smooth transitions and successful outcomes.",positive
"She approaches challenges with a positive mindset, seeing opportunities in every difficulty.",positive
"His genuine interest in others makes everyone feel valued and appreciated.",positive
"Her infectious laughter brings joy to even the most mundane moments.",positive
"His commitment to fairness and justice makes him a trusted advocate for equality.",positive
"With a strategic vision, she navigates complex situations with clarity and purpose.",positive
"His dedication to community service enriches the lives of those around him.",positive
"Her perseverance in pursuing her dreams inspires others to follow their passions.",positive
"His humility in success and graciousness in failure make him a role model for humility.",positive
"With an unwavering spirit, she never gives up on achieving her goals.",positive
"Her genuine empathy creates bonds of trust and understanding with everyone she meets.",positive
"His contagious enthusiasm lights up the room and motivates others to action.",positive
"Always eager to help, she lends a hand without hesitation or expectation of return.",positive
"His innovative approach to problem-solving leads to creative solutions and breakthroughs.",positive
"With a calm demeanor, she brings stability and reassurance in times of uncertainty.",positive
"Her relentless pursuit of excellence inspires those around her to aim higher.",positive
"His ability to see the big picture allows him to make strategic decisions with confidence.",positive
"Radiating positivity, she infuses optimism into every situation she encounters.",positive
"His humility is matched only by his willingness to acknowledge and learn from mistakes.",positive
"Committed to growth, she continuously seeks opportunities for personal and professional development.",positive
"His charisma and charm make him a natural leader who people are drawn to follow.",positive
"Her passion for environmental sustainability drives meaningful change within her community.",positive
"His dedication to honesty and integrity sets a standard others aspire to emulate.",positive
"With a heart of gold, she selflessly prioritizes the well-being of others.",positive
"Her unwavering faith in humanity inspires hope and compassion in those around her.",positive
"His ability to stay calm under pressure makes him a reliable anchor in turbulent times.",positive
"Always quick to lend an ear, she provides comfort and support through active listening.",positive
"His commitment to inclusivity creates a welcoming environment where diversity thrives.",positive
"With a sharp intellect, she tackles complex problems with clarity and ingenuity.",positive
"Her generosity knows no bounds, extending kindness to strangers and friends alike.",positive
"Despite her potential, she often lets self-doubt hold her back from achieving greatness.",negative
"His pessimistic outlook on life casts a shadow over even the brightest moments.",negative
"Her indifference towards others' feelings sometimes alienates those closest to her.",negative
"His tendency to procrastinate has resulted in missed opportunities and setbacks.",negative
"With a critical nature, she often undermines the efforts and ideas of her colleagues.",negative
"His reluctance to change stifles innovation and progress within the team.",negative
"Aloof and distant, she struggles to build meaningful connections with others.",negative
"His lack of accountability has eroded trust and respect among his peers.",negative
"Despite repeated feedback, she fails to take responsibility for her own actions.",negative
"His narrow-mindedness prevents him from considering alternative viewpoints.",negative
"Her constant need for validation makes her overly dependent on others' opinions.",negative
"His careless attitude towards details often leads to avoidable mistakes and errors.",negative
"With a defeatist attitude, she gives up easily when faced with challenges.",negative
"His arrogance and entitlement alienate those who might otherwise support him.",negative
"Despite opportunities for growth, she remains complacent in her current role.",negative
"His tendency to gossip undermines team morale and trust among colleagues.",negative
"Her fear of failure paralyzes her, preventing her from taking necessary risks.",negative
"Despite her talents, she often undermines herself with self-destructive behaviors.",negative
"His inability to listen to feedback hinders his personal and professional growth.",negative
"Her reluctance to collaborate makes teamwork difficult and inefficient.",negative
"Her constant negativity drains the energy of those around her, creating a toxic atmosphere.",negative
"His tendency to blame others for his mistakes undermines team cohesion and trust.",negative
"Despite promises of change, he continues to fall short of expectations.",negative
"With a confrontational demeanor, she often escalates conflicts rather than resolving them.",negative
"His inability to manage time effectively results in missed deadlines and unfinished projects.",negative
"Her lack of empathy makes it difficult for others to relate to her on a personal level.",negative
"His resistance to feedback and constructive criticism hinders his professional development.",negative
"Despite repeated warnings, she continues to engage in unethical behavior.",negative
"With a closed-minded approach, he dismisses new ideas without giving them proper consideration.",negative
"Her perfectionism leads to unrealistic expectations and unnecessary stress.",negative
"His inconsistent work ethic undermines his credibility and reliability.",negative
"Despite opportunities for improvement, he remains stubbornly resistant to change.",negative
"Her passive-aggressive behavior creates tension and mistrust in the workplace.",negative
"His inability to take ownership of his mistakes damages his reputation.",negative
"Despite being capable, she often chooses the path of least resistance.",negative
"With a tendency to micromanage, he stifles creativity and initiative in his team.",negative
"Her lack of transparency breeds suspicion and uncertainty among her colleagues.",negative
"His disorganization causes chaos and confusion in his day-to-day responsibilities.",negative
"Despite warnings about confidentiality, he has been known to leak sensitive information.",negative
"Her tendency to prioritize personal gain over teamwork undermines collective success.",negative
"His constant complaining brings down the morale of the entire team.",negative
"Despite opportunities for growth, she remains stuck in a cycle of mediocrity.",negative
"With a habit of making excuses, he fails to take accountability for his actions.",negative
"Her lack of initiative frustrates those who depend on her to take action.",negative
"His passive demeanor allows others to take advantage of his kindness.",negative
"Despite her potential, she consistently underperforms in critical tasks.",negative
"His disregard for deadlines disrupts workflow and causes delays.",negative
"Her tendency to gossip spreads rumors and undermines trust in the workplace.",negative
"Despite repeated warnings, he continues to exhibit unprofessional behavior.",negative
"With a tendency to exaggerate, she often distorts the truth to fit her narrative.",negative
"His reluctance to collaborate isolates him from valuable team contributions.",negative
"Despite promising ideas, she struggles to execute plans effectively.",negative
"His lack of empathy towards colleagues creates a hostile work environment.",negative
"Her reluctance to adapt to change hinders progress within the organization.",negative
"Despite clear instructions, he frequently overlooks important details.",negative
"With a habit of interrupting, she fails to respect others' contributions.",negative
"His habit of over-promising and under-delivering damages client relationships.",negative
"Despite his intelligence, he lacks common sense in practical situations.",negative
"Her disregard for feedback impedes her professional growth.",negative
"His tendency to hoard information creates silos and hampers teamwork.",negative
"She walked into the room with a calm demeanor, surveying the space quietly and attentively.",neutral
"The weather forecast predicted mild temperatures and occasional clouds throughout the upcoming week.",neutral
"The book on the shelf had a plain cover with simple text, indicating its general content.",neutral
"At the meeting, each participant contributed their thoughts in a structured and orderly manner.",neutral
"The building's architecture featured clean lines and a functional design, reflecting its utilitarian purpose.",neutral
"The new software update included several bug fixes and performance improvements without any major changes.",neutral
"He answered the questions during the interview with clear and direct responses, staying on topic.",neutral
"The garden was well-maintained, with neatly trimmed hedges and evenly spaced flowerbeds.",neutral
"The road ahead was straight and unobstructed, with clear signage indicating the direction to follow.",neutral
"The conference room was equipped with basic furniture and audiovisual equipment for presentations.",neutral
"Her explanation of the process was straightforward, detailing each step without unnecessary elaboration.",neutral
"The landscape was a mix of flat fields and gentle hills, characteristic of the regional geography.",neutral
"The report provided an overview of the project’s progress, including key milestones and upcoming deadlines.",neutral
"The painting on the wall depicted a serene scene, with soft colors and balanced composition.",neutral
"The restaurant's menu featured a variety of dishes, each described in simple, descriptive terms.",neutral
"The lecture covered fundamental concepts in a clear and organized manner, suitable for beginners.",neutral
"The online article presented an unbiased view of the topic, supported by factual information and data.",neutral
"The office layout was functional, with workstations arranged to maximize efficiency and ease of access.",neutral
"The public park had a variety of amenities, including benches, walking paths, and well-maintained lawns.",neutral
"The film's plot was straightforward, following a linear narrative with a predictable sequence of events.",neutral
"The library was quiet and orderly, with books arranged neatly on the shelves.",neutral
"His report included detailed statistics and charts, providing a clear view of the data.",neutral
"The kitchen was equipped with standard appliances, including a refrigerator, stove, and microwave.",neutral
"The event schedule was posted on the bulletin board, listing times and locations for each activity.",neutral
"The hotel room was furnished with basic amenities such as a bed, desk, and television.",neutral
"She provided a brief overview of the company’s history during the presentation.",neutral
"The park featured several walking trails and picnic areas, suitable for outdoor activities.",neutral
"The instructions were written in plain language, making them easy to understand and follow.",neutral
"The street was lined with trees and streetlights, contributing to a well-lit and pleasant environment.",neutral
"The online course covered fundamental principles, with modules designed to build knowledge progressively.",neutral
"The artist’s work was displayed in a simple gallery setting, allowing the pieces to be the main focus.",neutral
"The computer screen showed a clean interface, with icons and menus arranged for ease of use.",neutral
"The public transportation system included buses and trains, providing various options for commuters.",neutral
"The classroom was equipped with desks, chairs, and a whiteboard for instructional purposes.",neutral
"The neighborhood was characterized by residential houses and well-maintained sidewalks.",neutral
"The menu offered a range of beverages, from soft drinks to coffee and tea.",neutral
"The laboratory had basic equipment for experiments, including beakers, test tubes, and microscopes.",neutral
"The conference featured a series of workshops and keynote speeches, organized by topic.",neutral
"The apartment was designed with an open floor plan, including a living area and kitchen space.",neutral
"The exhibition included a variety of artifacts, each labeled with descriptive information.",neutral
"The garden had a variety of plants, including flowers, shrubs, and trees, all neatly arranged.",neutral
"The office was decorated with minimalistic furniture and neutral colors, creating a professional atmosphere.",neutral
"The weather was consistently mild, with temperatures ranging from 60 to 70 degrees Fahrenheit.",neutral
"The store’s layout was designed for easy navigation, with clear signage and organized sections.",neutral
"The webpage featured a simple design, with a header, body text, and footer clearly delineated.",neutral
"The classroom was equipped with basic educational tools, such as textbooks, notebooks, and a projector.",neutral
"The apartment complex included amenities like a gym, swimming pool, and laundry facilities.",neutral
"The report outlined the project’s objectives and timelines, presented in a clear and concise manner.",neutral
"The trail through the woods was marked with signs, guiding hikers along the path.",neutral
"The museum exhibit displayed historical artifacts in well-lit cases, with informative labels.",neutral
"The computer program included a user-friendly interface, with easily accessible menus and options.",neutral
"The bakery offered a selection of baked goods, including bread, pastries, and cakes.",neutral
"The public library had a variety of books and media available for borrowing, organized by category.",neutral
"The meeting room was equipped with a conference table, chairs, and a whiteboard for notes.",neutral
"The service center handled customer inquiries and provided support for various issues and concerns.",neutral
"The road construction was signposted with warnings and detours to guide drivers safely around the area.",neutral
"The hotel’s lobby featured comfortable seating and a reception desk for checking in and out.",neutral
"The grocery store was stocked with fresh produce, dairy products, and pantry staples.",neutral
"The park’s playground included swings, slides, and climbing structures for children.",neutral
"The software included a help section with tutorials and FAQs to assist users with common issues.",neutral
"The room was filled with a cacophony of sounds, with conversations, alarms, and music all blending together.",chaotic
"Files and documents were scattered everywhere, creating a cluttered landscape of mixed-up information.",chaotic
"The event schedule was a patchwork of overlapping times and locations, with no clear sequence of activities.",chaotic
"The street was a labyrinth of signs and barriers, with routes changing unpredictably as you drove.",chaotic
"People moved in all directions at the festival, with no clear paths or organization among the crowds.",chaotic
"The new software interface was a jumble of buttons and menus, with no obvious way to navigate the options.",chaotic
"The construction site was a whirlwind of machinery and materials, with equipment moving in every direction.",chaotic
"The emergency drill involved rapid and erratic movements, with instructions given in a disordered fashion.",chaotic
"The storage room was packed with a chaotic mix of supplies and equipment, making it hard to locate anything.",chaotic
"The traffic lights were malfunctioning, resulting in a constant and unpredictable flow of vehicles at the intersection.",chaotic
"The brainstorming session was a flurry of disconnected ideas, with participants shouting out concepts without coordination.",chaotic
"The restaurant's menu was a confusing array of dishes with no clear categories or organization.",chaotic
"The neighborhood was a swirl of various construction projects and street closures, creating an ever-shifting landscape.",chaotic
"The classroom was filled with a mix of disorganized papers, unplanned activities, and random student comments.",chaotic
"The online platform experienced a barrage of simultaneous user requests, causing a chaotic mix of notifications and errors.",chaotic
"The grocery store’s layout changed frequently, with aisles and sections being rearranged without notice.",chaotic
"The park was a scatter of picnic areas, playgrounds, and trails, with no clear map or directions for visitors.",chaotic
"The data presented was a mash-up of incomplete charts and mixed metrics, with no cohesive overview.",chaotic
"The festival grounds were a mix of tents, stages, and activities, with no discernible order to the setup.",chaotic
"The art gallery displayed a haphazard collection of pieces, with no clear theme or arrangement.",chaotic
"The festival was a swirl of performers, food stalls, and impromptu gatherings, with no discernible order or layout.",chaotic
"The online form was a jumble of fields and checkboxes, with questions appearing in a random, unpredictable sequence.",chaotic
"The construction site was filled with a flurry of moving parts, from cranes to trucks, all operating in a tangled mess.",chaotic
"The data dashboard displayed an overwhelming mix of graphs, tables, and alerts, all competing for attention.",chaotic
"The library was a disarray of books and papers, with no clear system for organization or categorization.",chaotic
"The street market featured a chaotic mix of vendors, each with different setups and no uniform arrangement.",chaotic
"The experiment’s results were a chaotic blend of unexpected outcomes and irregular data points.",chaotic
"The office's open plan was a mess of scattered desks, personal items, and random office supplies.",chaotic
"The website's homepage was a chaotic mix of pop-ups, banners, and links, with no clear focus or navigation.",chaotic
"The event’s schedule was a confusing array of overlapping panels, sessions, and activities without any clear order.",chaotic
"The art installation featured an eclectic mix of materials and styles, creating a visually chaotic experience.",chaotic
"The conference room was filled with a chaotic blend of presentations, papers, and interruptions from all sides.",chaotic
"The emergency response was a chaotic mix of overlapping sirens, shouting, and urgent activities.",chaotic
"The social media feed was a rapid stream of mixed posts, with trending topics and personal updates blending together.",chaotic
"The workshop had a chaotic flow of activities, with participants jumping from one task to another without a clear structure.",chaotic
"The kitchen was a whirlwind of cooking utensils, ingredients, and dishes, all piled up in no particular order.",chaotic
"The neighborhood was a chaotic blend of different construction noises, with various projects happening simultaneously.",chaotic
"The online meeting was a chaotic mix of overlapping voices, screen sharing issues, and technical glitches.",chaotic
"The shopping mall was a maze of crowded stores, random displays, and inconsistent layouts.",chaotic
"The laboratory was a whirlwind of experiments, with equipment and samples scattered in every direction.",chaotic
"The street was a whirlwind of flashing lights, construction noises, and unpredictable traffic patterns.",chaotic
"The sports event was a blur of players, referees, and spectators, with constant movement and noise.",chaotic
"The party was a chaotic mix of people, music, and decorations, with no clear space or arrangement.",chaotic
"The museum exhibit was a haphazard collection of artifacts, displayed with no apparent theme or order.",chaotic
"The festival grounds were filled with a chaotic blend of tents, stages, and food stalls, all intermingling.",chaotic
"The airport terminal was a frenzy of travelers, announcements, and moving walkways, creating a confusing atmosphere.",chaotic
"The email inbox was a chaotic mess of unread messages, urgent alerts, and promotional content.",chaotic
"The construction site was a tangled web of scaffolding, machinery, and workers all operating without a clear pattern.",chaotic
"The software application was a chaotic interface of overlapping windows, confusing icons, and mixed commands.",chaotic
"The park was a chaotic mix of children playing, dogs running, and picnickers scattered around.",chaotic
"The fashion show was a whirlwind of models, flashing cameras, and rapidly changing outfits, all blending together.",chaotic
"The office was a mix of scattered papers, random meetings, and overlapping phone calls, creating constant confusion.",chaotic
"The trade show featured a chaotic array of booths, demonstrations, and promotional giveaways, all competing for attention.",chaotic
"The city’s streets were a chaotic blend of traffic jams, construction detours, and emergency vehicles.",chaotic
"The academic conference had a chaotic schedule of presentations, workshops, and networking events, all overlapping.",chaotic
"The restaurant's layout was a chaotic arrangement of tables and chairs, with diners and servers moving in all directions.",chaotic
"The social event was a chaotic mix of conversations, loud music, and impromptu activities, with no clear structure.",chaotic
"The library’s renovation led to a chaotic arrangement of bookshelves, construction materials, and misplaced books.",chaotic
"The online game was a chaotic scene of fast-moving characters, constant alerts, and unpredictable events.",chaotic
"The holiday parade was a whirlwind of floats, bands, and crowds, with no clear order or sequence to the festivities.",chaotic
"The flibberwocky zoodlesplint meandered through the quizzleflap, causing a jibblewock of snarfblats.",gibberish
"Zorptastic flimmendoodles sprangled the plonkish flibber with a wibblesnarf of drindled blorp.",gibberish
"Jibblewumps and flibberwibbles danced through the quorfleblap, creating a snizzle of groft!",gibberish
"The frobnix glorped as it zoodlesplatted, making the whizzlefrap pop with a blarnick blop.",gibberish
"Snarfblat flimmering through the yibblewock caused a wibberfloop of zizzlecranks and drindlepop.",gibberish
"The gropmendoodle snarfed the zibberflap, causing a plopstinkle of wibblewacks and zoodlenaps.",gibberish
"Blornkets and flibberflops zibbled in the whizzlecrank, creating a quibblesnarf of froplendinks.",gibberish
"The splibberwock twizzled through the drindleblap, making a quorp of snizzleblats and glorpwibbles.",gibberish
"Froplendoodles whizzled as the zibberflap jorped with a snarfleplop and blorptastic grop.",gibberish
"The zizzleflap dribbled with a flonkblat of frobnicks and whizzlecranks, creating a splibberwock of gloop.",gibberish
"Blorflewacks zibbled around the snarfblat, making a plinkthorp of drindleflops and quibblewocks.",gibberish
"Flibblewocks and snarfleblaps glorped in the zibbleflap, creating a wizzlepop of froplendoodles.",gibberish
"The jibberwock danced through the groftsnip, causing a wibblecrank of blornkets and splonks.",gibberish
"Snizzlewocks whizzled and drindled as the zorp flap jibbled with a glorpblat and frizzlefloop.",gibberish
