sentences,feeling_category
"The drindlecrank blopped with a snarfleflop, creating a zibblesnarf of froplendinks and whizzlebops.",gibberish
"Froblitzers quibbled through the plonkish zoodles, making a groft of snizzleblats and blorpwibbles.",gibberish
"The wibberwock zibbled and plonked through the drindlesnap, creating a quorptastic blonklepop.",gibberish
"Blonkdrips snarfled as the zibberwock danced with a splibber of groftblats and zizzlecranks.",gibberish
"The snarflepop dribbled with a froblonk of glorpwibbles and wibbercranks, causing a zibblewock.",gibberish
"Froplendoodles flonked as the zibbercrank snarfled through the glorp, creating a quibblewack of snizzleflops.",gibberish
"The blorflesnarp zibbled through the quibbleflop, making a jibblewock of snarflewhats and zoodlecrinks.",gibberish
"Frizzlewocks and drindleplops whizzled in a snarflecrank, creating a frobnix of zibblewocks and glorp.",gibberish
"The snizzleplop zorped as the glimblesnarf wibbled with a quibberplop and frobblewock.",gibberish
"Zibbleflaps and groftwocks flimmered in the plopsnick, causing a wibblecrank of snarfleblats.",gibberish
"The plonkfrap flibbled with a drindlewock, creating a zorp of snizzlefloop and quibblepop.",gibberish
"Glorpblats and snarflewhats twizzled in the zibberflap, making a blonklepop of drindlecranks.",gibberish
"The fribblewock zibbled and snarfed as the glibberflap made a wizzlecrank of quorpblats.",gibberish
"Snizzlewhats and flimmerblaps zorped through the groftwock, causing a fribberpop of quibblefloop.",gibberish
"The drindlewhack snarfled with a wobbleplop, creating a zibblecrank of frobnix and whizzleflaps.",gibberish
"Blorptastic zibbles and whizzlecranks dribbled in a froplendoodle, causing a snarflepip of groft.",gibberish
"The zibberwock flonked through the glorpblap, making a snizzlefloop of quibblewocks and drindleblats.",gibberish
"Froplendinks and blorflepops zibbled through the snarfleflap, creating a groft of zibblecranks and whizzles.",gibberish
"The snarflewhats zorped and blorped in a fribblewock, making a zibbleplop of quibblefloop.",gibberish
"Quibbleblaps and groftwibbles snarfled through the zibblewhack, creating a frobnix of glorpblats.",gibberish
"The glorpwock flibbled as the snizzlepop zibbled with a fribblecrank and blonkfloop.",gibberish
"Drindlecranks and froplendoodles zorped in the blorfleplop, causing a wizzlecrank of snarflewhats.",gibberish
"The quibblefloop zibblewocked through the groftblat, making a snizzlewhack of drindlesnarf.",gibberish
"Flibblewocks and snarfleblats twizzled in the zibberwhack, creating a quorp of fribblefloop and groft.",gibberish
"The snizzlefloop zorped with a blorpwock, causing a fribblepop of zibblecranks and snarflewhats.",gibberish
"Groftblats and quibblewocks flibbled through the zibblewhack, making a zorp of snizzlecranks and froplendoodles.",gibberish
"The wobblecrank flibbled through the snizzlepop, causing a quibblewhack of frobnix and glorpblats.",gibberish
"Zibblewocks and snarfleflaps zorped in the fribblewock, creating a blorp of quibblefloops and groftwocks.",gibberish
"The drindlewhack zibbled as the plonklecrank zorped with a snizzleplop and froblonk.",gibberish
"Snarflepips and glorpwibbles twizzled through the zibberflop, causing a quibblepop of snizzlecranks.",gibberish
"The blorflecrank snarfled with a fribbleplop, creating a zibblewock of quorpblats and drindlesnarf.",gibberish
"Froplendoodles and snizzlewocks flibbled in the groftplop, making a zorp of fribblewhats and glorpblats.",gibberish
"The zibberwhack zorped through the snizzleplop, causing a wibblecrank of quibblefloops and frobnix.",gibberish
"Groftwocks and fribblecranks zibbled in the blorpwock, creating a snarfleflap of quibblewhats.",gibberish
"The plonklewhack flibbled with a snizzlecrank, making a fribblepop of zibblecranks and froplendoodles.",gibberish
"Snizzleblats and zibblewocks whizzled through the groftplop, causing a quorp of fribblefloops.",gibberish
"The wobblefloop zorped and blorped in the snarflepip, creating a zibblecrank of groftblats.",gibberish
"Quibblewhats and snizzlewocks zibbled through the plonkcrank, causing a blorp of froplendoodles and groft.",gibberish
"The fribblewock flibbled through the snizzlefloop, making a quibblewhack of zibblecranks and frobnix.",gibberish
"Glorpblats and fribblefloops snarfled in the wobblecrank, creating a snizzleplop of quorpblats.",gibberish
"The zibberplop twizzled with a snarflepip, making a zibblewock of fribblewhats and quibbleblats.",gibberish
"Snizzlecranks and groftwocks zorped through the blorpplop, creating a quibblefloop of fribblewocks.",gibberish
"The plonklewock flibbled with a snizzlepop, causing a wobblecrank of quibblecranks and froplendoodles.",gibberish
"Froplendoodles and snarflewhats zibbled in the snizzlewhack, creating a blorp of zibblecranks and groft.",gibberish
"The quibblefloop zorped through the glorpblat, making a snarflepip of fribblewocks and zibblewhack.",gibberish
"Blorpwocks and snizzleplops flibbled through the groftplop, causing a quibblewhack of zibblewocks.",gibberish
"Rplxkfwz Qdjnrmv Xieowhp Tzlgcvu Mtysbk Wkjxqo Zfrbndc Lvapsgd Wtuqyb Rmpkxno Ydsfvh Lxjqec Tnzgior Brklyw Qmpecx Wtrbzo",true_random_gibberish
"Gxnwkp Zdshyvt Lrfqmc Xojmdp Tzqfub Hrlcxv Koyjpn Mzdcwe Tprxjq Lvlrwo Yfkset Qmdncb Vwjzlx Rgihpo Bvtyzq Ksyxwj",true_random_gibberish
"Lxjdwkm Hnbzvq Rzptlc Qgoewx Kfyrms Zjcbdp Tvlhpo Wxrne Gzskvq Mnhbix Rjotyd Pbfwmn Lqvcth Xgopwy Fkrljz Wyzrpd",true_random_gibberish
"Gwlxrjm Qkdbnh Yfztcp Pvojwl Zrthme Nsbkxd Lwvjqu Oiuwpc Rpfyxl Tkdnvr Zxjmrh Wrbzlg Hqioxf Cmtvyp Kdgnjw Bpeuyq",true_random_gibberish
"Mvxjbr Tlkpyd Zfqmrn Hegvwx Ldzyqp Qwbjof Rkxpvl Yoiubc Nsczrg Wtrblf Kjpdye Zghqmk Rxlwtn Fmpnvo Cdyjrz Bslqio",true_random_gibberish
"Qmwdgk Hblfxp Zyprvn Lctjzw Rskhob Tgvxyq Qnljpf Wzkrmc Obncyx Ftdpsv Lirjow Yqmbwx Zchfeu Tpkvjd Wrfzlg",true_random_gibberish
"Lwvjpd Ykbzmc Hrxnfg Zpmdqo Fltxwr Qgwevn Rkjxoc Vsdnpl Mbyzoq Wtrcxf Kiwjea Zqxrh Wbdnlk Lfyptg Hszmcv Qocjdn",true_random_gibberish
"Pzyxjl Khtcvr Ndbswq Rgikze Lxmvfo Wcjnrb Qpyevx Sztloq Mlfbkw Yvpgdr Hmnxow Tjebkp Lwzqci Vhrfpm Qsojrd",true_random_gibberish
"Jbxovw Nsfmkq Yzcwpl Qkdtvn Rjxpog Tlgwzf Hpycnb Xmrjuv Lzqtwc Vdiybx Fhpomk Rcrzgj Wtqfsn Nlwoji Kbpxmv",true_random_gibberish
"Hrmtbx Ykpnv Qlcjzw Fprvxd Omgblj Wdxoqt Zivucm Rwskfe Lnbgdh Kzqxrc Tspmvo Wflzpd Ygkwrb Nvjxql Htbsfc",true_random_gibberish
"Jxmvqd Qplzyf Rsbcnw Yfgtop Kcwejh Tlrnbm Vgzoxk Nsqxpd Lfhbvc Wmjkzr Qrwold Xydjmv Hkptql Bfznso Wtcgrx",true_random_gibberish
"Tqovfn Lmxdpr Zkrjbc Hfyvow Qlrxct Wpjkze Nsbldq Ygmvwt Kxvrpf Rofqjn Tslbmc Wdoyrv Qhnzjp Mlbxkw Hfcqry",true_random_gibberish
"Rhpjzx Qlvdcn Wkbgyp Xytwmv Ndzfro Kqwslh Mjvibc Lsxrpz Htfqwo Ykpjdm Nlbgv Rzowqf Vtcrjh Poyxsl",true_random_gibberish
"Wzoymc Tqfrxk Vpjhdg Lxkobr Ntfwuv Yhmglq Rbcjzv Qwoxnp Kdpfmj Zrlyqe Hbncsx Wmldtv Qsorxp Lujkgd",true_random_gibberish
"Rdfyzx Kbmtqc Wjovnl Xshgrp Lwqzfu Pcxojk Nyrmdv Qgtbvx Vplkso Zfhryc Lmwdxn Hjrbcq Tskfpg Yvohjl",true_random_gibberish
"Mzqrbp Wjoksv Xlydnc Qhptgf Kvnfrz Ywljx Rzcpot Lmvdhb Nxtuoq Qbfkyp Hwrnzc Tgjlmr Vxpzyw",true_random_gibberish
"Lzmrcx Qkfpnd Wxvzor Hdbjyt Mjqlwf Ytrcvo Znhpxg Ksgwlj Rqnvud Tpfhxb Wcdzrs Ybmrpl Nlwyko",true_random_gibberish
"Wzjfvx Lcdpko Qrnmbt Xohsjk Kmvgyw Rfztqj Yclnrx Mxkvwb Qdgopl Zytjnw Hsbrf Lweqmd Tkpvxo",true_random_gibberish
"Rmpxkt Lqgvyj Wzsdco Xlbnrt Yfhmpk Qjrzov Kcwtlu Hdbsfx Mvljoq Znpbxy Tpgdcr Yswemk",true_random_gibberish
"Tgwrkp Qbczyo Wmvjx Hflprt Zydxwc Nslqoj Kvxhzb Rjmdof Xytnpl Lkpqfr Ybwjmz Qhrdvc",true_random_gibberish
"Vrbkzpq Hxdmcw Ytwjfo Zglnsp Mvrtdk Qcwbko Xrlfyd Ztmgsp Bnkxdj Tpwvuf Lrjhoe Zscqnb Ykvxmd Qhjgfw Xyzbkp Rmoqwl Jxpvde Lbktzf Yoshrn Dvqfml Qyxgcp Rljzxo Tbnwvr",true_random_gibberish
"Gmrtbq Xlwvne Zkqpdj Jxsflo Ynhczv Rbqgdm Wtjxrl Fpkyuo Lrmbpd Zwsqvn Cxkpgt Yjxwfe Mzrclo Hfwdvn Tjprks Vloqnb Qcdzxu Rgkypm Zvlbwo Wfnxrd Tpsqhi Ljyfvw",true_random_gibberish
"Wtpjqk Fmrzxc Lhndpw Zgbfry Yvwsml Rdxpoj Ktfhce Qxmkvd Jzrbxn Vnypqw Lgtrdc Hkvlbf Zsdywo Tpxmrv Lcybqe Qnjgrx Wzplvd Rmofqc Tjkrzv Xhdlgn",true_random_gibberish
"Zbmrkp Qtdfnx Yvwglh Xjcfoe Rmkdsp Vnlrwy Hqzptv Gzxdol Tbcfwy Lmvxrk Wjpylo Qshzxd Btlrkp Zowvme Fskjqn Xphwrl Hcybvn Qtkxjd Mflrwy",true_random_gibberish
"Fypnbd Wktocq Qmrhzl Xgvdpc Zlneoj Jyswvf Bxlpzr Rndkqi Vwjmle Hgzqvo Kxrycf Tplhbn Zmrdkg Yfsqpj Vtwxlj Rkdnzq",true_random_gibberish
"Vnkqpd Zyxrct Hmowfj Lxrwce Yhjpzd Qbtmro Xcvwkl Fdlsjp Rmvznh Kxpcwb Gqdoey Nwtbkr Ylfgsj Xrjofe Tqznbv",true_random_gibberish
"Xphkzd Womvrq Ftyjcn Rbklws Yzvpxg Ndfjoc Qhztrv Lrmpkw Jvcefd Xznsqb Ktrolm Ypwnfr Djsbvx Qfmhpo Lxgkcr Vwdzpl",true_random_gibberish
"Krgztc Xlqnbp Ydjfos Mvwnle Hxbkpv Qtrwje Lzsmnd Fgkrcd Zptxwo Jcvmbn Yhrxpl Wdfqoz Rknjgs Tfbvwm Xpdzlc",true_random_gibberish
"Tnqkpx Lsvbmc Zfdyxr Wgzqon Rvthpw Jkmzdl Qxcrgv Mphowz Yrfvxl Xlkjgb Wznmct Lpjoyk Hscvdq Ymtzrk Vbqjwf",true_random_gibberish
"Wmrndk Yfpbvg Qzslxd Ktrjow Xdphme Rznjlc Hqkxvp Lbyfgo Vwcrdz Tjxwlo Yfrnkb Mwdcpg Lqmhsy Zxdbrt",true_random_gibberish
"Hpzvql Mjkfwo Ygcrbs Lxpdzq Rtvxne Qjflkm Wkmdsg Yzwjxc Bspqvn Tzfhre Lnhvdc Xygrtq Qfrkbl Zpmxvo Lwdjso",true_random_gibberish
"Tqzvdp Rylqow Xgkcmh Zjsbro Wfdknc Lhxjpv Yrmzbq Vnbfjo Ktpdxe Qlwyzr Xncfos Mwbgrj Hsldkv Yxmtpc Zrjqgb",true_random_gibberish
"Wmrkpx Zsfqdl Htjgop Yblcwv Qvnjxe Kxpmrj Lgdbny Xhwtvz Rzkvso Fdlqcn Yxwbfm Qjbrzp Mvhnwq Ltcodj",true_random_gibberish
"Nqkxlz Wtdmpo Ygvwqf Jhrbce Zrxmld Fpvcdo Xzbljn Lqmdsy Rftwno Qjkbxc Yshqvd Mxpdwr Vzlrgj Kylbwf",true_random_gibberish
"Rtnkjp Qwfzsl Lypmrb Xgkvoj Wxdctq Ynhbrm Fvclso Zrpwkj Mblxvq Tdphec Kmrwvn Qjsfob Lzwypt",true_random_gibberish
"Jwpbzy Xqgldf Kmrctn Yvzohr Lzqbdx Wnlpvj Rsdgxf Qfokmw Vtbjyr Hpzmdn Lwvxqc Ybrfzo Xklqjd Tchpbv",true_random_gibberish
"Rqkpjz Mdvlfw Xnoyec Zgkrmb Hplstw Ycdjvn Qxwhfp Lzgrbo Tnkxdv Vmbjql Lwfcrd Jzqrbm Xotkcy",true_random_gibberish
"Wnbxjz Lhdtfg Yckowq Rpsnvc Kxvleb Zmrjqd Fpvzow Tjbhxk Qlwdfn Xzgmoj Mrlvnb Ycwpqf Rzktvx",true_random_gibberish
"Lrmfkw Qpxrjd Hncbzy Zvtgpl Xsdjwc Yhkwqo Rvmltx Kqpgjf Wtfbne Lzxqor Mphdjc Vnrbwy Tszkvo",true_random_gibberish
"Fplvnr Jzxkwm Qbsyoc Rdfgkj Xycvzp Ktbrxl Wsmnhy Zowqfn Hpqxjc Ldvrxg Mtnjsy Vxwbqd Ylkpzr",true_random_gibberish
"Xvknwpl Ztsjcf Mrdgkb Yqoixz Wpxrnj Lbfdyq Kzmthc Qvowxr Hplfjb Vydcmk Zrlsoq Qbkxvd Tjpmtc Xynfrw Lwbgoh Gsrkqz Ndoitc Zykbwp",true_random_gibberish
"Jznvpt Rqfhdw Lbxgkq Yopzvc Tmwrex Kcpljb Zsfqnd Xjvdmo Htrlgz Vwycqn Lkbxvf Mpgjze Qdcrhw Ylfozt Rnjqvp Xwsklo",true_random_gibberish
"Ywlmfp Xbdzkv Qpcvhs Rtmogj Znrwqx Lsjvgb Wkcrd Tnqowp Vhgrzb Mxkfdj Yozrlt Rjmksc Xzqnvh Lptwob Kbgfme Wydhsn",true_random_gibberish
"Jqvsxr Kdbhzp Lympqw Xtdjnf Zfocle Wgmrkb Qnrjyp Vxwzlg Mbtvdk Yklrhw Rjfxnq Lpwozy Zcgmjd Thbsvr Qyploc",true_random_gibberish
"Tgplzq Kfhdwv Xbmtro Zjnysc Qrwljo Lmzpkn Yxgdbv Rkwcfp Vtqhsn Jxlbmo Hfpdqr Mvtyzk Xrjdnw Lsgcwb Zxylvf",true_random_gibberish
"Rnkxjw Tqlcmo Zpvrbe Ygfwjx Ksmvnd Hxpbzy Lcfqkt Wjdoqr Xnrlmg Vtbkqw Ysdhvp Zcrjfo Lqrmze Wpxnrb",true_random_gibberish
"Xgqplb Mzskwv Ybdjrf Htmcno Qxwkrz Lvsdjq Zrfcpt Wyljmo Kxprzv Nbhqrf Jgtlxy Vdpowm Rjznbk Lfcwds",true_random_gibberish
"Wczbdk Qmfyvj Lxrhod Zntgwp Yplkmr Xwvnsq Kdgzfc Rmjtlp Hptcwe Vxjbzo Yqgknd Lbzwcf Tnoxhr Mvwkpl",true_random_gibberish
"Lfrqyb Tnpwso Kzgxmd Xpjbvn Qztrhd Vcljwo Rmgykp Wdsnbh Lxvzcq Yhfqmp Zkbjlr Jdwnco Rftgks Mvbhxz",true_random_gibberish
"Zbkwpl Hjtqfd Xydrnq Qnspgb Vklmzo Lmrjwv Rfpcxn Ytzlko Wgdsbc Kqvhlx Lrxmpn Vzfhjt Yowkdz Mplbcy",true_random_gibberish
"Fvmpjb Zlhnro Xytqwd Qpkjvc Rsbwxy Kdtznv Lrmfoc Wjqgkp Ybcnlx Zvfswd Xgpohr Lqmdvk Rwnzfe Tylscx",true_random_gibberish
"Qfgxtn Vbjpwy Kldszm Xovrhn Lqpcjd Wryxfo Zhkgbm Mnlcpr Tjsqvr Yzwkox Lxrfjd Hmpbqe Rzvltc Kfdpwn",true_random_gibberish
"Wbdjmf Zrfcxl Xgpvkb Lshwoc Kjtqvn Ympwzq Rnchxo Tlpgyf Vdwsrq Lqznbj Xymcdo Hkfvpz Nbgjdq",true_random_gibberish
"Tszvpl Xynfdw Kqrbjv Lmwgzc Yoxqhr Rjldcf Vpkmto Wgbzqe Nxyhdo Fsdmrl Qvjkcw Lrnxzw Yhctbq",true_random_gibberish
"Rztmbx Xfwdlk Ypjvno Kqgdzc Lrhlvq Wmsnoy Vbcktr Qjovze Lpfgdh Xzyrws Mtnxdq Hrljop Ybscwp",true_random_gibberish
"Ybgpmd Xfrjzl Ktqovw Lrzshc Qwbjko Vxndgf Wymzpc Htqvln Rpldxs Mzcjhy Lvnfow Zrfwkp",true_random_gibberish
"Wjxfzr Qpdhyb Lmtwov Xcjknd Ylrqsz Kbgvmp Rfcslo Tzxvqn Lrpwce Hmndjg Vzqkyx",true_random_gibberish
"Ztrbqd Lkcnjw Xyvpom Qsfgrh Wdploz Rvnkxe Hxmjfw Ybgctk Ldqrnc Tzjvpb Xqwhro Mvklxe",true_random_gibberish
"Fjqyvm Ksbplx Zdmnqv Wcrgko Xlpyzd Htnbwj Rjofpq Lxwsmd Yhvztk Tqcnbv Vdghpl",true_random_gibberish
"Lmpvfc Qxdybh Xztwkl Yovgmd Zbnfwr Rjkspl Tdlcxo Wfgzqr Ktnpvb Hxrmjw Lcoynx",true_random_gibberish
"Hewwo! I hope you'we having a wondewful day and aww the nice things awe coming youw way! UwU",uwu
"Whewe awe you going? I wanna come awong and have a wot of fun together! OwO",uwu
"I just wuv you so much and you'we the bestest fwiend evew! ^_^",uwu
"Dewemembew to aways twy youw best and be kind to evewyone awound you! >w<",uwu
"Wanna go get some yummie snacks and pway some games? It'ww be so much fun! >ω<",uwu
"I am so gweatful fow having you in my wife, you make evewything bettew! (≧∇≦)",uwu
"Whewe did you get that adowable outfit? It's so cute and you wook pawsome! ^w^",uwu
"I can't wait to heaw about youw adventuwes and what you'we up to watewy! :3",uwu
"Wooking fowawd to ouw next hangout, it's awways a bwast when we're togethew! UwU",uwu
"Wishing you aww the happiness and wuv in the wowld, you desewve it aww! owo",uwu
"Hewwo! I just wanted to say how much I appweciate you and you'we so special! ^_^",uwu
"Did you see the latest movie? It was so funny and the chawactews wewe so cute!",uwu
"Let's have a picwic in the pawk and enjoy the sunshine togethew, it'ww be gweat! >ω<",uwu
"I aways have so much fun chatting with you, you make evewything better! ^w^",uwu
"I hope you'we having a wewaxing and nice day, full of happy moments! (o^▽^o)",uwu
"Thank you fow being such a wondewful fwiend and always being thewe fow me! >w<",uwu
"Can we pway some video games togethew soon? I'ww wuv to team up with you! UwU",uwu
"I wuv youw positivity and how you always bwing a smile to evewyone's face! owo",uwu
"Let's have a fun movie night and enjoy some yummie popcorn and snacks! ^_^",uwu
"You'we the best and I appweciate aww the wovely things you do! Thank you so much! (｡♥‿♥｡)",uwu
"Hewwo! I hope you'we having a wondewful day and that aww the nice things awe coming youw way, I can't wait to heaw about youw exciting news! UwU",uwu
"Whewe awe you going? I wanna come awong and have a wot of fun togethew, maybe we can explore some new pwaces and eat some yummy food! OwO",uwu
"I just wuv you so much and you'we the bestest fwiend evew, I aways wook fowawd to spending time with you and making more memowies togethew! ^_^",uwu
"Dewemembew to aways twy youw best and be kind to evewyone awound you, it'ww make a big diffewence and spwead positive vibes evewywhewe! >w<",uwu
"Wanna go get some yummie snacks and pway some games? It'ww be so much fun, we can pick out ouw favowite snacks and pway untwiw we'we all tiwed out! >ω<",uwu
"I am so gweatful fow having you in my wife, you make evewything bettew and I can't imagine my days without you, you'we the bestest! (≧∇≦)",uwu
"Whewe did you get that adowable outfit? It's so cute and you wook pawsome, I bet evewyone is wowed by how stunning you awe! ^w^",uwu
"I can't wait to heaw about youw adventuwes and what you'we up to watewy, it'ww be so gweat to catch up and shawe ouw stories! :3",uwu
"Wooking fowawd to ouw next hangout, it's awways a bwast when we're togethew, I'ww be counting down the days untiw we can meet again! UwU",uwu
"Wishing you aww the happiness and wuv in the wowld, you desewve it aww and I hope evewything you'we hoping fow comes twue! owo",uwu
"Hewwo! I just wanted to say how much I appweciate you and you'we so special, you make me smiwe even on the toughest days and I'ww nevew fowget that! ^_^",uwu
"Did you see the latest movie? It was so funny and the chawactews wewe so cute, I'ww wuv to heaw youw thoughts on it and discuss ouw favowite pawts!",uwu
"Let's have a picwic in the pawk and enjoy the sunshine togethew, it'ww be gweat to have some wawm weadew and tasty food whiwe we wawk awound! >ω<",uwu
"I aways have so much fun chatting with you, you make evewything bettew and I wuv heawing youw funny stowies and catching up on each othew's wives! ^w^",uwu
"I hope you'we having a wewaxing and nice day, full of happy moments and wuv, you desewve to have a bweath of fweshing aiw and enjoy the moment! (o^▽^o)",uwu
"Thank you fow being such a wondewful fwiend and always being thewe fow me, you'we a wock in the storm and I can't thank you enough fow youw suppowt! >w<",uwu
"Can we pway some video games togethew soon? I'ww wuv to team up with you and have a fun time, I'ww be counting the days untiw we can pway again! UwU",uwu
"I wuv youw positivity and how you always bwing a smile to evewyone's face, you awe a wight of sunshine and make evewyone's day bweathe with joy! owo",uwu
"Let's have a fun movie night and enjoy some yummie popcorn and snacks, I'ww pwovide the snacks if you bwing the movie, and we'ww have a gweat time! ^_^",uwu
"You'we the best and I appweciate aww the wovely things you do, you'we always so thoughtful and kind, and I'ww be hewe fow you no mattew what! (｡♥‿♥｡)",uwu
"Hewwo! I just wanted to say how much I enjoy spending time with you, evewy moment we shawe togethew is so special and fun! UwU",uwu
"I can’t wait to heaw about youw latest pwans and adventures, I'ww be so excited to catch up and heaw about everything you'we doing! OwO",uwu
"You'we so amazing and I'ww aways appweciate how you'we aways thewe to hewp me, you make every day so much bweatew! ^_^",uwu
"Don’t fowget to take some time fow youwself and enjoy some wewaxation, you desewve it and it’ww make you feel so much bettew! >w<",uwu
"Let’s pwans a day to go out and expwowe new pwaces, maybe we can find a cute cafe and twy some dewicious new treats togethew! >ω<",uwu
"I’m so happy to have you in my wife, you'we such a positive infwuence and I'ww aweady be wooking fowawd to ouw next hangout! (≧∇≦)",uwu
"I saw youw watewy photos and they’we absowutewy stunning, you'we so good at capturing the moment and I'ww be jeawous of youw photogenic skills! ^w^",uwu
"It’s always a gweat time when we catch up and tawk about evewything that’s been happening, I'ww wook fowawd to ouw next chat! :3",uwu
"I can’t wait to see you again and have anothew gweat day togethew, we’ww pwobabwy laugh and make so many funny memowies! UwU",uwu
"Wishing you a day filled with wuv and joy, you’we such a wondewful pewson and I hope aww youw wishes come twue today! owo",uwu
"Hewwo! Just wanted to check in and see how you'we doing, I hope you'we having a fabuwous day and that evewything is going weww! ^_^",uwu
"Did you catch the watewy stowy about the new pwoducts? I'ww be so happy to chat about it and heaw youw thoughts on the watewy news!",uwu
"How about we spend the day at the beach and enjoy the sunshine, we can bwing some snacks and have a wovewy time on the sand togethew! >ω<",uwu
"I wuv how we can tawk about anything and evewything, you’we aways so thoughtful and it's awways a bweeze spending time with you! ^w^",uwu
"I hope you'we having a wawm and cozy day, full of happy thoughts and wuv, you desewve all the best and more good things to come! (o^▽^o)",uwu
"Thank you fow being such an incwedibwy supportive fwiend, you'we awways thewe when I need you and I'ww be hewe fow you too! >w<",uwu
"Can we pway some co-op games togethew soon? I'ww be so excited to team up with you and have a gweat time playing and winning togethew! UwU",uwu
"I wuv how you'we awways so enthusiastic and positive, you bwing such a wight and happy vibe to evewyone awound you, it’s gweat! owo",uwu
"Let’s pwans a day to enjoy some movies and snacks, I'ww bwing the snacks if you bwing the movies, and we’ww have so much fun! ^_^",uwu
"You'we the bestest fwiend and I’ww be so gwateful fow everything you do fow me, you'we always so kind and thoughtful and I'ww appweciate you fowevew! (｡♥‿♥｡)",uwu
"H3ll0! I h0p3 y0u'v3 b33n 4bl3 t0 3nj0y 4 l0t 0f g00d t1m3s 4nd th4t 3v3ryth1ng 1s g01ng w3ll f0r y0u! 1337",leet
"1 c4n't w41t t0 h34r 4ll 4b0ut y0ur l4t3st 4dv3ntur3s 4nd wh4t y0u'v3 b33n up t0, 1'm 50 3xc1t3d! OwO",leet
"Y0u'v3 b33n 50 gr34t 4nd 1 4m 50 th4nkful f0r 4ll th3 tim3 w3'v3 5p3nt t0g3th3r, y0u'v3 m4d3 my d4y5 b3tt3r! ^_^",leet
"D0n't f0rg3t t0 t4k3 50m3 t1m3 t0 w1nd d0wn 4nd r3l4x, 1t'5 imp0rt4nt t0 ch4rg3 y0ur b4ttery5 4nd 5t4y h34lthy! >w<",leet
"L3t'5 m33t up s00n 4nd 3nj0y 50m3 d3l1c10u5 f00d, w3 c4n 5p3nd th3 d4y ch4tt1ng 4nd h4v1ng 4 gr34t t1m3! >ω<",leet
"I'm 50 4ppr3c14t1v3 0f y0u b31ng 1n my lif3, y0u'v3 b33n 4 gr34t 5upport 4nd 4lw4y5 m4k3 th1ng5 50 much b3tt3r! (≧∇≦)",leet
"Wh3r3 d1d y0u g3t th4t 4w350m3 5tuff? 1t'5 50 c00l 4nd y0u'v3 4lw4y5 h4d 50me gr34t t4st3! ^w^",leet
"I'11 b3 50 h4ppy t0 c4tch up w1th y0u 4nd h34r 4ll 4b0ut y0ur l4t3st 3xc1t1ng 3xper1enc3s 4nd 4dv3ntur3s! :3",leet
"L00k1ng f0rw4rd t0 0ur n3xt 5h3n4n6 4nd 5p3nd1ng 50m3 qu4l1ty tim3 t0g3th3r, 1t'5 4lw4y5 4 b1g bl4st! 1337",leet
"W1sh1ng y0u 4 w0nd3rful d4y f1ll3d w1th 50 much j0y 4nd h4pp1n3ss, y0u d35rv3 4ll th3 b3st 1n th3 w0rld! 0w0",leet
"H3ll0! I h0p3 y0u'v3 b33n h4v1ng 4 gr34t d4y 4nd th4t 3v3ryth1ng 15 g01ng w3ll, 1'11 b3 th3r3 4nyt1m3 y0u n33d! ^_^",leet
"D1d y0u h34r 4b0ut th3 n3w r3l34s3? 1t'5 50 4w350m3 4nd I'11 b3 50 3xc1t3d t0 533 1t w1th y0u!",leet
"W3 c4n h4v3 4 p1cn1c 1n th3 p4rk, 1t'5 4 gr34t w4y t0 3nj0y th3 w34th3r 4nd 50m3 d3l1c10u5 5n4ck5! >ω<",leet
"1 4lw4y5 h4v3 50 much fun wh3n w3 ch4t, y0u'v3 4lw4y5 b33n 50 3nt3rt41n1ng 4nd 1'11 w4nt t0 h34r m0r3! ^w^",leet
"1 h0p3 y0u'v3 b33n h4v1ng 4 w4rm 4nd c0zy d4y, 1t'5 50 1mp0rt4nt t0 5t4y w3ll 4nd 3nj0y th3 m0m3nt5! (o^▽^o)",leet
"Th4nk y0u f0r b31ng 50 4m4z1ng 4nd 4lw4y5 b31ng th3r3 f0r m3, y0u'v3 b33n 4 r0ck 4nd I'11 4lw4y5 4ppr3c14t3 y0u! >w<",leet
"C4n w3 pl4y 50m3 n3w v1d30 g4m3s 50on? 1'11 b3 50 3xc1t3d t0 t34m up w1th y0u 4nd h4v3 4 gr34t t1m3! 1337",leet
"1 wuv y0ur p0s1t1v1ty 4nd h0w y0u 4lw4y5 br1ng 4 5m1l3 t0 3v3ry0n3'5 f4c3, y0u'v3 b33n 4 r34l b1essing! 0w0",leet
"L3t'5 pl4n 4 movie n1ght 4nd 3nj0y 50m3 yummi3 p0pc0rn 4nd 5n4ck5, 1t'5 4 p3rf3ct w4y t0 r3l4x 4nd h4v3 fun! ^_^",leet
"Y0u'v3 b33n 50 gr34t 4nd 1 4m 50 th4nkful f0r 4ll th3 l0v3ly th1ng5 y0u d0, 1'11 b3 h3r3 f0r y0u n0 m4tt3r wh4t! (｡♥‿♥｡)",leet
"H3ll0! 1 h0p3 y0u'v3 b33n 4bl3 t0 5p3nd 4 l0t 0f qu4l1ty tim3 w1th y0ur f4m1ly 4nd fr13nd5, 1t'5 4lw4y5 g00d t0 c4tch up w1th th3 p30pl3 y0u c4r3 4b0ut! 1337",leet
"I w4nt t0 5t4rt pl4nn1ng 4n 4w350m3 w33k3nd g3t4w4y w1th y0u, w3 c4n ch00s3 4 c00l d3st1n4t10n 4nd 3nj0y 50m3 5un4nd f00d t0g3th3r! >w<",leet
"Y0u'v3 b33n 50 4m4z1ng 4nd 1 w4nt t0 5h4r3 h0w m4ny 1mpr3ss1v3 th1ng5 y0u'v3 b33n d01ng, 1t'5 50 1n5p1r1ng t0 533 y0u 5ucce3d! ^w^",leet
"1 c4n't w41t t0 s33 y0u 4nd 5p3nd 4n0th3r 5up3rb d4y t0g3th3r, w3 c4n 50 t4lk, l4ugh, 4nd m4k3 50me n3w m3m0r135 th4t w3'11 4lw4y5 ch3r15h! :3",leet
"L3t'5 h4v3 4 f4nt4st1c d4y 1n th3 c1ty, 5w4r1ng 4r0und t0 5ee th3 l4t3st 4ttr4ct10n5, 4nd 3nj0y 50m3 5tr34t5, 1t'5 4 gr34t w4y t0 br34k 4w4y fr0m th3 d41ly r0ut1n3! 1337",leet
"1 4lw4y5 4ppr3c14t3 y0u b31ng 4lw4y5 5o p05it1v3 4nd 3nc0ur4g1ng, y0u m4k3 1t 50 34sy t0 f33l g00d 4nd b3 h4ppy, 1'm 50 th4nkful! >ω<",leet
"1'm 50 3xc1t3d f0r 0ur n3xt 5h3n4n6 4nd t0 5h4r3 m0r3 4w350m3 5t0r135 4nd 3xp3r13nc3s w1th y0u, 1t'5 4lw4y5 4 bl4st! ^_^",leet
"W1th th3 w34th3r b34t1ng d0wn 0n u5, 1 th1nk 1t'5 4 gr34t t1m3 t0 c0z1n3 up 4nd w4tch 50m3 g00d m0vi3s 0r r34d 4 b00k, wh4t d0 y0u th1nk? 0w0",leet
"H3ll0! 1 w4nt t0 5ay h1 4nd 4ppreci4t3 4ll th3 tim3 y0u'v3 5p3nt h3lp1ng m3 w1th my pr0j3ct5, y0ur 5upport h4s b33n 1n3st1m4bl3! (≧∇≦)",leet
"1'm r34lly l00k1ng f0rw4rd t0 0ur pl4nn3d v4c4t10n, w3 c4n 3nj0y 4 l0t 0f r3l4x4t10n 4nd fun 4t 4 b34ch 0r 5om3 0th3r c00l l0c4t10n! >w<",leet
"L3t'5 pl4n 4 ch3rry-p1ck3d 3v3nt w1th 50m3 4w350m3 p33pl3, w3 c4n m4k3 50m3 gr34t m3m0r135 4nd 3nj0y th3 d4y t0g3th3r! ^w^",leet
"I 5aw y0ur l4t3st p0st 4nd 1t'5 50 1n5p1r1ng, y0u'v3 4ccompl1sh3d 50 m4ny gr34t th1ng5 4nd 1'11 b3 50 h4ppy t0 h34r m0r3 4b0ut 1t! :3",leet
"1 h4v3 b33n th1nk1ng 4b0ut 50me n3w 5tr4t3g135 f0r 4dv4nc1ng my 5k1ll5 4nd 1 th1nk 1t w0uld b3 gr34t t0 h34r y0ur 0p1n10n5 4nd 4dv1c3! 0w0",leet
"H3ll0! 1 w4nt3d t0 l3t y0u kn0w th4t 1'11 b3 4b5ent f0r 4 wh1l3, but 1'm 50 3xc1t3d t0 c4tch up 4nd 5p3nd tim3 w1th y0u 4g41n s00n! (｡♥‿♥｡)",leet
"W3 c4n 5p3nd th3 d4y v1s1t1ng 50m3 4w350m3 5it35 4nd 3nj0y 4ll th3 b34ut1ful 5c3n3rY, 1'm 50 4nthu51a5t1c 4bout th1s 1d34! ^_^",leet
"1'11 b3 50 3xc1t3d t0 5p3nd 4 wh0l3 d4y t0g3th3r, w3 c4n d0 50m3 4m4z1ng 4ct1v1t13s 4nd 3nj0y 4 gr34t t1m3, 1t'5 4lw4y5 50 m4ch fun! >ω<",leet
"L3t'5 h4v3 4 d4y 0f 4dv3ntur3 4nd 3xc1t3m3nt, w3 c4n 3xpl0r3 n3w 4r34s 4nd 5c3n3r13$, 1'11 b3 50 h4ppy t0 b3 p4rt 0f 1t! ^w^",leet
"I c4n’t w41t t0 h34r 4ll 4b0ut y0ur n3w 1d34$, 1m 50 1nt3r35t3d 1n kn0w1ng m0r3 4nd h34r1ng 4b0ut y0ur 3xc1t1ng pl4n5! (≧∇≦)",leet
"1 h4v3 b33n 5t4r1ng 4t 50m3 n3w pr0j3ct5 4nd 1 th1nk 1t'5 g01ng t0 b3 4m4z1ng t0 5h4r3 my pr0gr3ss w1th y0u 4nd g3t y0ur 1n5ight5! 0w0",leet
"W3 5h0uld pl4n 4n 4w350m3 d4y 0f 4dventur3, 1t'5 4 gr34t w4y t0 3nj0y 50m3 qu4l1ty tim3 4nd 5p3nd 1t t0g3th3r, 1'11 b3 50 3xc1t3d! >w<",leet
"1 r34lly 4pprec14t3 y0ur h34rty 4nd c4r1ng n4tur3, 1t'5 50 r3fr3sh1ng t0 b3 4r0und 50m30n3 4s 4m4z1ng 4s y0u, 1'm 50 th4nkful! ^_^",leet
"H34r1ng 4b0ut y0ur n3w pr0j3ct5 4nd 1d34$ 1s 50 1ntr1gu1ng, 1'11 b3 50 h4ppy t0 h34r m0r3 4b0ut 1t 4nd 5h4r3 1n y0ur 3xc1t3m3nt! ^w^",leet
"L3t'5 5p3nd th3 d4y 3nj0y1ng 50m3 4ct1v1t13$ 4nd v15it1ng 50me 1nt3r35t1ng pl4c3$, 1'm 50 3xc1t3d t0 5h4r3 th3 3xp3r13nc3 w1th y0u! :3",leet
